{
  "$schema": "translations-schema.json",
  "USED_KEY": "Das ist ein gebrauchter Schl端ssel",
  "UNUSED_KEY": "Das ist ein unbenutzter Schl端ssel",
  "ENUM_KEY_dog": "Hund",
  "ENUM_KEY_cat": "Katze",
  "ENUM_KEY_mouse": "Maus",
  "OBJECT_KEY": {
    "USED_KEY": "Das ist ein gebrauchter Schl端ssel",
    "UNUSED_KEY": "Das ist ein unbenutzter Schl端ssel"
  }
}